{"schema":"lockwood.cleanup-authorization-result/v1","handoff_digest":"sha256:9999999999999999999999999999999999999999999999999999999999999999","hold_snapshot_digest":"sha256:ffffffffffffffffffffffffffffffffffffffffffffffffffffffffffffffff","hold_decision":"not-held","authorization":{"target_digest":"sha256:1111111111111111111111111111111111111111111111111111111111111111","action":"cleanup-delete","principal_reference":"amber:principal:cleanup-0001","identity_verified":false,"authorization_decision":"authorized","authorization_verified":true,"assertion_digest":"sha256:cccccccccccccccccccccccccccccccccccccccccccccccccccccccccccccccc","policy_digest":"sha256:dddddddddddddddddddddddddddddddddddddddddddddddddddddddddddddddd","revocation_snapshot_digest":"sha256:eeeeeeeeeeeeeeeeeeeeeeeeeeeeeeeeeeeeeeeeeeeeeeeeeeeeeeeeeeeeeeee","evaluated_at":"2026-09-17T12:30:00Z"}}
